{
  "schema_version": "1.1",
  "instrument": {
    "name": "3-6岁幼儿发展优势与兴趣画像测评",
    "version": "1.0.0",
    "date": "2026-06-02",
    "age_range": "3-6",
    "language": "zh-CN",
    "item_bank_version": "1.1.2"
  },
  "child": {
    "child_id": "cid-3de65ce6-3f4b-4205-adf2-87423afa6717",
    "nickname": "豆豆",
    "birth_month": "2021-12",
    "age_months_at_submit": 54,
    "sex": "girl"
  },
  "age_band": "4-5",
  "consent": {
    "agreed": true,
    "consent_version": "1.1",
    "agreed_at": "2026-06-03T19:27:51+08:00"
  },
  "responses": [
    {
      "item_id": "TMP-01",
      "section": "TMP",
      "construct": "外向性/活跃性 Surgency",
      "subscale": "活动水平",
      "report_subscale": "活动水平",
      "cluster": null,
      "consistency_pair_id": null,
      "question_text": "在家里，孩子总是跑来跑去、闲不下来。",
      "scale": "freq5",
      "raw_value": 3,
      "value_label": "有时",
      "age_band": "4-5",
      "reverse": false,
      "scored": true,
      "anchor_shown": null
    },
    {
      "item_id": "TMP-02",
      "section": "TMP",
      "construct": "外向性/活跃性 Surgency",
      "subscale": "活动水平",
      "report_subscale": "活动水平",
      "cluster": null,
      "consistency_pair_id": null,
      "question_text": "孩子喜欢长时间安静地坐着做一件事。",
      "scale": "freq5",
      "raw_value": 3,
      "value_label": "有时",
      "age_band": "4-5",
      "reverse": true,
      "scored": true,
      "anchor_shown": "如能安静做一会儿手工"
    },
    {
      "item_id": "TMP-03",
      "section": "TMP",
      "construct": "外向性/活跃性 Surgency",
      "subscale": "社交接近",
      "report_subscale": "社交接近",
      "cluster": null,
      "consistency_pair_id": null,
      "question_text": "到了有很多小朋友的新场合，孩子很快就能加入大家一起玩。",
      "scale": "freq5",
      "raw_value": 2,
      "value_label": "偶尔",
      "age_band": "4-5",
      "reverse": false,
      "scored": true,
      "anchor_shown": "观察一会儿后能加入"
    },
    {
      "item_id": "TMP-04",
      "section": "TMP",
      "construct": "外向性/活跃性 Surgency",
      "subscale": "害羞/慢热",
      "report_subscale": "害羞/慢热",
      "cluster": null,
      "consistency_pair_id": null,
      "question_text": "第一次见到陌生人时，孩子会害羞、躲开或不说话。",
      "scale": "freq5",
      "raw_value": 4,
      "value_label": "经常",
      "age_band": "4-5",
      "reverse": true,
      "scored": true,
      "anchor_shown": "观察一会儿才靠近"
    },
    {
      "item_id": "TMP-05",
      "section": "TMP",
      "construct": "外向性/活跃性 Surgency",
      "subscale": "趋避/适应",
      "report_subscale": "趋避/适应",
      "cluster": null,
      "consistency_pair_id": null,
      "question_text": "换到新环境（新班级、新地方），孩子需要比较长的时间才能适应。",
      "scale": "freq5",
      "raw_value": 4,
      "value_label": "经常",
      "age_band": "4-5",
      "reverse": true,
      "scored": true,
      "anchor_shown": "换新环境约需几天才能融入"
    },
    {
      "item_id": "TMP-06",
      "section": "TMP",
      "construct": "外向性/活跃性 Surgency",
      "subscale": "冒险/高强度愉悦",
      "report_subscale": "冒险/高强度愉悦",
      "cluster": null,
      "consistency_pair_id": null,
      "question_text": "孩子喜欢玩刺激的游戏，比如被举高、转圈、快速滑滑梯。",
      "scale": "freq5",
      "raw_value": 3,
      "value_label": "有时",
      "age_band": "4-5",
      "reverse": false,
      "scored": true,
      "anchor_shown": "爱爬高、玩得很疯"
    },
    {
      "item_id": "TMP-07",
      "section": "TMP",
      "construct": "外向性/活跃性 Surgency",
      "subscale": "冒险/高强度愉悦",
      "report_subscale": "冒险/高强度愉悦",
      "cluster": null,
      "consistency_pair_id": null,
      "question_text": "遇到有点难度或有点冒险的玩法，孩子愿意去尝试。",
      "scale": "freq5",
      "raw_value": 3,
      "value_label": "有时",
      "age_band": "4-5",
      "reverse": false,
      "scored": true,
      "anchor_shown": "敢爬较高的攀爬架"
    },
    {
      "item_id": "TMP-08",
      "section": "TMP",
      "construct": "负性情绪 Negative Affectivity",
      "subscale": "挫折/愤怒反应",
      "report_subscale": "挫折/愤怒反应",
      "cluster": "resilience",
      "consistency_pair_id": null,
      "question_text": "想做的事被打断或做不成时，孩子会生气、发脾气。",
      "scale": "freq5",
      "raw_value": 3,
      "value_label": "有时",
      "age_band": "4-5",
      "reverse": false,
      "scored": true,
      "anchor_shown": "抗议、喊叫"
    },
    {
      "item_id": "TMP-09",
      "section": "TMP",
      "construct": "负性情绪 Negative Affectivity",
      "subscale": "挫折/愤怒反应",
      "report_subscale": "挫折/愤怒反应",
      "cluster": "resilience",
      "consistency_pair_id": null,
      "question_text": "玩具被别的小朋友拿走时，孩子会很激动地反应。",
      "scale": "freq5",
      "raw_value": 3,
      "value_label": "有时",
      "age_band": "4-5",
      "reverse": false,
      "scored": true,
      "anchor_shown": null
    },
    {
      "item_id": "TMP-10",
      "section": "TMP",
      "construct": "负性情绪 Negative Affectivity",
      "subscale": "可安抚性",
      "report_subscale": "可安抚性",
      "cluster": "resilience",
      "consistency_pair_id": null,
      "question_text": "孩子发脾气或哭闹后，能比较快地平静下来。",
      "scale": "freq5",
      "raw_value": 4,
      "value_label": "经常",
      "age_band": "4-5",
      "reverse": false,
      "scored": true,
      "anchor_shown": "说几句能平复"
    },
    {
      "item_id": "TMP-11",
      "section": "TMP",
      "construct": "负性情绪 Negative Affectivity",
      "subscale": "恐惧/谨慎",
      "report_subscale": "恐惧/谨慎",
      "cluster": null,
      "consistency_pair_id": null,
      "question_text": "遇到大的声响或陌生的动物，孩子会害怕。",
      "scale": "freq5",
      "raw_value": 3,
      "value_label": "有时",
      "age_band": "4-5",
      "reverse": false,
      "scored": true,
      "anchor_shown": "怕某些具体声音/动物"
    },
    {
      "item_id": "TMP-12",
      "section": "TMP",
      "construct": "负性情绪 Negative Affectivity",
      "subscale": "恐惧/谨慎",
      "report_subscale": "恐惧/谨慎",
      "cluster": null,
      "consistency_pair_id": null,
      "question_text": "做没把握的事情前，孩子会显得担心、犹豫。",
      "scale": "freq5",
      "raw_value": 4,
      "value_label": "经常",
      "age_band": "4-5",
      "reverse": false,
      "scored": true,
      "anchor_shown": "做之前先问能不能"
    },
    {
      "item_id": "TMP-13",
      "section": "TMP",
      "construct": "努力控制 Effortful Control",
      "subscale": "注意聚焦/坚持",
      "report_subscale": "注意聚焦/坚持",
      "cluster": "focus_persistence",
      "consistency_pair_id": null,
      "question_text": "做自己感兴趣的事时，孩子能专注比较长的时间。",
      "scale": "freq5",
      "raw_value": 5,
      "value_label": "几乎总是",
      "age_band": "4-5",
      "reverse": false,
      "scored": true,
      "anchor_shown": "能完成一个有步骤的小任务"
    },
    {
      "item_id": "TMP-14",
      "section": "TMP",
      "construct": "努力控制 Effortful Control",
      "subscale": "注意聚焦/坚持",
      "report_subscale": "注意聚焦/坚持",
      "cluster": "focus_persistence",
      "consistency_pair_id": null,
      "question_text": "做一件事时，孩子很容易被周围的事物吸引而分心。",
      "scale": "freq5",
      "raw_value": 2,
      "value_label": "偶尔",
      "age_band": "4-5",
      "reverse": true,
      "scored": true,
      "anchor_shown": null
    },
    {
      "item_id": "TMP-15",
      "section": "TMP",
      "construct": "努力控制 Effortful Control",
      "subscale": "注意聚焦/坚持",
      "report_subscale": "注意聚焦/坚持",
      "cluster": "focus_persistence",
      "consistency_pair_id": null,
      "question_text": "遇到有点难的任务，孩子会坚持尝试而不是马上放弃。",
      "scale": "freq5",
      "raw_value": 4,
      "value_label": "经常",
      "age_band": "4-5",
      "reverse": false,
      "scored": true,
      "anchor_shown": "卡住会换个方法试"
    },
    {
      "item_id": "TMP-16",
      "section": "TMP",
      "construct": "努力控制 Effortful Control",
      "subscale": "抑制控制",
      "report_subscale": "抑制控制",
      "cluster": "inhibitory_control",
      "consistency_pair_id": null,
      "question_text": "当大人说「先等一下」，孩子能忍住、等一会儿。",
      "scale": "freq5",
      "raw_value": 4,
      "value_label": "经常",
      "age_band": "4-5",
      "reverse": false,
      "scored": true,
      "anchor_shown": "能等几十秒"
    },
    {
      "item_id": "TMP-17",
      "section": "TMP",
      "construct": "努力控制 Effortful Control",
      "subscale": "抑制控制",
      "report_subscale": "抑制控制",
      "cluster": "inhibitory_control",
      "consistency_pair_id": null,
      "question_text": "被告知不可以碰的东西，孩子还是会忍不住去碰。",
      "scale": "freq5",
      "raw_value": 2,
      "value_label": "偶尔",
      "age_band": "4-5",
      "reverse": true,
      "scored": true,
      "anchor_shown": "提醒后能短暂忍住"
    },
    {
      "item_id": "TMP-18",
      "section": "TMP",
      "construct": "努力控制 Effortful Control",
      "subscale": "抑制控制",
      "report_subscale": "抑制控制",
      "cluster": "inhibitory_control",
      "consistency_pair_id": null,
      "question_text": "很想要某样东西时，孩子能按约定先等一等再拿。",
      "scale": "freq5",
      "raw_value": 4,
      "value_label": "经常",
      "age_band": "4-5",
      "reverse": false,
      "scored": true,
      "anchor_shown": "约定后能短暂等待"
    },
    {
      "item_id": "TMP-19",
      "section": "TMP",
      "construct": "外向性/活跃性 Surgency",
      "subscale": "冒险/高强度愉悦",
      "report_subscale": "冒险/高强度愉悦",
      "cluster": null,
      "consistency_pair_id": null,
      "question_text": "玩刺激的活动时孩子常意犹未尽，会主动要求「再来一次、再快一点、再用力点」，想让刺激变得更强。",
      "scale": "freq5",
      "raw_value": 3,
      "value_label": "有时",
      "age_band": "4-5",
      "reverse": false,
      "scored": true,
      "anchor_shown": "玩着玩着主动要求加码——「再快点、再高点」"
    },
    {
      "item_id": "SEL-01",
      "section": "SEL",
      "construct": "自我调节·情绪面 Self-Regulation",
      "subscale": "情绪调节",
      "report_subscale": "情绪调节",
      "cluster": "resilience",
      "consistency_pair_id": null,
      "question_text": "遇到不顺心的事（如玩具被拿走、要求被拒绝），孩子能在较短时间内平静下来。",
      "scale": "freq5",
      "raw_value": 4,
      "value_label": "经常",
      "age_band": "4-5",
      "reverse": false,
      "scored": true,
      "anchor_shown": "提醒后能等一会儿"
    },
    {
      "item_id": "SEL-02",
      "section": "SEL",
      "construct": "自我调节·情绪面 Self-Regulation",
      "subscale": "情绪调节",
      "report_subscale": "情绪调节",
      "cluster": "resilience",